Country,Destination,TopSight,Description,Rating,NumberOfReview,Type,TypicalTimeSpent,Latitude,Longitude,Option0,Option1,Option2,Option3,Option4,Option5,Option6,Option7,Option8,Option9,Option10
Isle of Man,Isle of Man,Bradda Hill,"Bradda Hill is a headland some 2 kilometres north of the village of Port Erin on the Isle of Man. It is not to be confused with Bradda Head which is about 2 kilometres to the SW.
The path to the summit from Bradda West is part of the Raad ny Foillan, the Isle of Man Coast long distance footpath.",,,,,,,Kid-friendly,,,,,,,,,
Isle of Man,Isle of Man,North Barrule,"North Barrule is the second highest peak in the Isle of Man at 565 metres. From the summit the northern plain of the Isle of Man can be viewed along with the coastlines of Ireland, Cumbria, Wales and Scotland.
The North Barrule is located at grid reference 442909 and forms the north-eastern end of a ridge.",5.0,2,,,,,Kid-friendly,,,,,,,,,
Isle of Man,Isle of Man,Laxey Woollen Mills,,4.5,108,"Tourist attraction in Laxey, Isle of Man",45 min,54.2307854,-4.4031073,Kid-friendly,,,,,,,,,
Isle of Man,Isle of Man,"Kate's Cottage, Isle of Man","Kate's Cottage is a historic house which is one of Isle of Man's Registered Buildings.
It is situated near to the summit of Slieau Ree adjacent to the 34th Milestone racing road-side milestone marker used for the Snaefell Mountain Course on the primary A18 Mountain Road in Onchan parish, Isle of Man.",4.3,7,Historical place on the Isle of Man,,54.2112259,-4.4769716,Kid-friendly,,,,,,,,,
Isle of Man,Isle of Man,Cronk ny Arrey Laa,"Cronk ny Arrey Laa is a hill in the south west of the Isle of Man. It may be confused with a hill of a similar name in the parish of Jurby, further north along the west coast of the island.
At 437 m it is the second highest hill in this part of the island, after the South Barrule, 2 miles to the east.",4.4,7,,,,,Kid-friendly,,,,,,,,,
Isle of Man,Isle of Man,Maughold Head,"Maughold Head is the easternmost point of the Isle of Man and the closest point in the Isle of Man to England, being 50 kilometres from St. Bees Head in Cumbria.
Maughold Head lies in the northeast of the island, some 5 kilometres from Ramsey, at the southern end of Ramsey Bay.",4.5,2,,,,,Kid-friendly,,,,,,,,,
Isle of Man,Isle of Man,Grove Museum,,4.5,56,"Museum in Ramsey, Isle of Man",,54.3324742,-4.3940406,Kid-friendly,,,,,,,,,
Isle of Man,Isle of Man,Cronk ny Merriu,"Cronk ny Merriu is one of the remains of promontory forts in the Isle of Man. Close to Port Grenaugh, this site dates back almost 2,000 years. The bank and ditch of Iron Age date created a defensive promontory fort at Cronk ny Merriu.",4.3,7,Tourist attraction on the Isle of Man,,54.1025862,-4.5749839,Kid-friendly,,,,,,,,,
Isle of Man,Isle of Man,Sulby Reservoir,"The Sulby Reservoir is the largest reservoir or lake in the Isle of Man, with an area of 154 acres.",4.8,16,Reservoir on the Isle of Man,,54.2685691,-4.5024635,Kid-friendly,,,,,,,,,
Isle of Man,Isle of Man,Slieau Freoaghane,"Slieau Freoaghane is a hill on the Isle of Man, and the second highest of the Island's five Marilyns. It is located in the Sheading of Michael and can be climbed from Kirk Michael or Barregarrow to the west, from Brandy Cottage to the south, or from Druidale in the east. The summit is marked with a trig point.",5.0,1,,,,,Kid-friendly,,,,,,,,,
Isle of Man,Port Erin,Calf of Man,"Calf of Man is a 2.50-square-kilometre island, off the southwest coast of the Isle of Man. It is separated from the Isle of Man by a narrow stretch of water called the Calf Sound. Like the nearby rocky islets of Chicken Rock and Kitterland, it is part of the parish of Rushen. It has only two seasonal inhabitants.",4.6,27,,,,,,,,,,,,,,
Isle of Man,Port Erin,Bradda Head,"Bradda Head is a rugged headland in the south-west of the Isle of Man, in the British Isles, rising to a height of 382 feet. It shelters Port Erin Bay from the north.
There is a clifftop walk, the Coronation Footpath, up to the head and around the head via Milner's Tower.",5.0,4,,,,,,,,,,,,,,
Isle of Man,Port Erin,Castle Rushen,"Castle Rushen is a medieval castle located in the Isle of Man's historic capital, Castletown, in the south of the island. It towers over the Market Square to the south-east and the harbour to the north-east.",4.5,730,"Medieval castle in Castletown, Isle of Man",,54.0738053,-4.6522796,,,,,,,,,,
Isle of Man,Port Erin,Mull Hill,"Mull Hill is a small hill in the exclave of Rushen Parish at the southern end of the Isle of Man, just outside the village of Cregneash. It is the site of a chambered cairn called Mull Circle or Meayll Circle. Near the summit of the hill also lie the remains of a World War II Chain Home Low RDF station.",5.0,1,,,,,,,,,,,,,,
Isle of Man,Port Erin,Isle of Man Railway Museum,The Isle of Man Railway Museum in the village of Port Erin in the Isle of Man is a small display that shows the history of the Isle of Man Railway through exhibits and visual displays which chart the ...,4.0,2,"Museum in Port Erin, Isle of Man",,54.0852049,-4.7579481,,,,,,,,,,
Isle of Man,Port Erin,Port Erin Beach,,4.7,28,,,,,,,,,,,,,,
Isle of Man,Port Erin,Bradda Hill,"Bradda Hill is a headland some 2 kilometres north of the village of Port Erin on the Isle of Man. It is not to be confused with Bradda Head which is about 2 kilometres to the SW.
The path to the summit from Bradda West is part of the Raad ny Foillan, the Isle of Man Coast long distance footpath.",,,,,,,,,,,,,,,,
Isle of Man,Port Erin,Milner's Tower,,4.9,84,Historical landmark on the Isle of Man,,54.0925397,-4.7778654,,,,,,,,,,
Isle of Man,Port Erin,Langness Peninsula,"Langness is a peninsula which protrudes two kilometres at the southern extremity of the Isle of Man. Signifying a cape or extended promontory, ""Langness"" literally means ""long promontory"" in Old Norse.",5.0,3,,,,,,,,,,,,,,
Isle of Man,Port Erin,Chicken Rock,"Chicken Rock, part of Rushen parish, is the southernmost island administered by the Isle of Man. It lies southwest of the Calf of Man, 4.5 kilometres off Spanish Head on the Manx mainland. The most prominent feature of the rock is the 19th century Chicken Rock Lighthouse.",4.0,4,,,,,,,,,,,,,,
Isle of Man,Ramsey,Milntown Estate and Gardens,,4.6,195,,1.5 hours,54.3198057,-4.4039726,,,,,,,,,,
Isle of Man,Ramsey,Snaefell,"Snaefell – is the highest mountain and the only summit higher than 2,000 feet on the Isle of Man, at 2,037 feet above sea level. The summit is crowned by a railway station, cafe and several communications masts.",4.7,50,,,,,,,,,,,,,,
Isle of Man,Ramsey,School House Corner,"School House Corner is a left curve on the primary A3 Lezayre Road in Ramsey, Isle of Man.
It is between the 23rd and 24th milestone road markers, on the 37.73-mile circuitous Mountain Course race track, measured from the starting line at the TT Grandstand.",5.0,1,"Historical landmark in Ramsey, Isle of Man",,54.3206408,-4.3933605,,,,,,,,,,
Isle of Man,Ramsey,Mooragh Promenade,,,,,,,,,,,,,,,,,
Isle of Man,Ramsey,Ramsey Beach,,4.6,34,"Tourist attraction in Ramsey, Isle of Man",45 min,54.3294121,-4.3825022,,,,,,,,,,
Isle of Man,Ramsey,Pepsi Max Bowl & Leisure Centre,,4.2,210,Bowling alley,1-2 hours,54.321686,-4.378026,,,,,,,,,,
Isle of Man,Ramsey,Mooragh Lake,,4.6,17,,,,,,,,,,,,,,
Isle of Man,Ramsey,Ramsey Hairpin,"Ramsey Hairpin is a point on the Snaefell Mountain Course used for the Isle of Man TT races on the Snaefell Mountain Road, designated as A18, in the parish of Maughold in the Isle of Man.",4.6,78,"Tourist attraction in Ramsey, Isle of Man",,54.3129997,-4.3849256,,,,,,,,,,
Isle of Man,Ramsey,Grove Museum,,4.5,56,"Museum in Ramsey, Isle of Man",,54.3324742,-4.3940406,,,,,,,,,,
Isle of Man,Ramsey,Albert Tower,"The Albert Tower, on the Isle of Man is a historic monument which is one of Isle of Man's Registered Buildings. It was registered on 27 January 2003 as number 212.
The tower is located in the parish of Maughold, but only about 100 metres south of the boundary with Ramsey and overlooking the town of Ramsey.",,,"Monument in Ramsey, Isle of Man",,54.312947,-4.3796925,,,,,,,,,,
Isle of Man,Ramsey,"Gooseneck, Isle of Man","Gooseneck, Isle of Man, is an acute uphill right-bend on the Snaefell Mountain Course used for the TT motorcycle races between the 25th and 26th Milestone racing road-side markers, on the 37+ mile circuitous-course, measured from the startline at the TT Grandstand.",4.7,81,Tourist attraction on the Isle of Man,,54.3052664,-4.3814983,,,,,,,,,,
Isle of Man,Ramsey,Ramsey Bay,"Ramsey Bay is a large bay covering some 94 square kilometres off the northeastern coast of the Isle of Man. It runs for 18 kilometres from the Point of Ayre at the island's northern tip to Maughold Head. The port town of Ramsey, the island's second town, lies towards the south of the bay.",5.0,1,,,,,,,,,,,,,,
Isle of Man,Ramsey,North Barrule,"North Barrule is the second highest peak in the Isle of Man at 565 metres. From the summit the northern plain of the Isle of Man can be viewed along with the coastlines of Ireland, Cumbria, Wales and Scotland.
The North Barrule is located at grid reference 442909 and forms the north-eastern end of a ridge.",5.0,2,,,,,,,,,,,,,,
Isle of Man,Ramsey,Ballure Reservoir,,5.0,1,,,,,,,,,,,,,,
Isle of Man,Ramsey,Maughold Head,"Maughold Head is the easternmost point of the Isle of Man and the closest point in the Isle of Man to England, being 50 kilometres from St. Bees Head in Cumbria.
Maughold Head lies in the northeast of the island, some 5 kilometres from Ramsey, at the southern end of Ramsey Bay.",4.5,2,,,,,,,,,,,,,,
Isle of Man,Laxey,Laxey Wheel,"The Laxey Wheel is built into the hillside above the village of Laxey in the Isle of Man. It is the largest working waterwheel in the world. Designed by Robert Casement, the wheel has a 72-foot-6-inch diameter, is 6 feet wide and revolves at approximately three revolutions per minute.",,,,,,,,,,,,,,,,
Isle of Man,Laxey,The Great Laxey Wheel,,4.6,130,"Museum in Laxey, Isle of Man",,54.238528,-4.407389,,,,,,,,,,
Isle of Man,Laxey,King Orry's Grave,"King Orry's Grave is the largest megalithic tomb on the Isle of Man. It is situated in Minorca, in the northern part of the village of Laxey, partly in a private cottage garden.",4.5,67,"Historical place in Laxey, Isle of Man",,54.2317444,-4.3929982,,,,,,,,,,
Isle of Man,Laxey,Great Laxey Mines Railway,,4.7,9,"Museum in Laxey, Isle of Man",,54.2337524,-4.4052041,,,,,,,,,,
Isle of Man,Laxey,Laxey Woollen Mills,,4.5,108,"Tourist attraction in Laxey, Isle of Man",45 min,54.2307854,-4.4031073,,,,,,,,,,
Isle of Man,Laxey,Laxey Beach,,4.6,90,"Tourist attraction in Laxey, Isle of Man",,54.2244988,-4.3924676,,,,,,,,,,
Isle of Man,Laxey,Laxey Bay,,,,"Nature preserve in Laxey, Isle of Man",,54.2336685,-4.4060267,,,,,,,,,,
Isle of Man,Laxey,Garwick Beach,,3.0,3,,,,,,,,,,,,,,
Isle of Man,Derbyhaven,Derbyhaven Beach,,,,,,,,,,,,,,,,,
Isle of Man,Ballasalla,Rushen Abbey,"Rushen Abbey is an abbey on the Isle of Man, located in Ballasalla. Originally home for monks of the Savignac order, it soon came under Cistercian control and remained so until its dissolution. The abbey is located two miles from Castle Rushen, the politically most important site on the island in medieval times.",4.2,113,"Abbey in Ballasalla, Isle of Man",,54.098204,-4.634116,,,,,,,,,,
